,title,article,link,summary
0,Are free markets history?,"ll too low, governments end up micro-managing the energy transition by decree.\nThis mix of protection, spending and regulation comes at a heavy cost. For a start, it is a misdiagnosis. The pooling of risks is indeed an essential function of governments. But not all risks: for markets to work, actions must have consequences. \nIn contrast to the accepted view, covid and the Ukraine war have shown that markets deal with shocks better than planners do. Globalised trade coped with huge swings in consumer demand: throughput at America’s ports in 2021 was 11% higher than in 2019. In 2022 Germany’s economy repeated the trick, suffering no calamity as it switched rapidly from Russian gas to other sources of energy. By contrast, state-dominated markets like the supply of shells for Ukraine are still struggling. Just like the old complaints about trade with China—which has boosted Americans’ real incomes—gripes about globalisation’s supposed fragility have built a cathedral of fear over a grain of truth.\nAnother flaw in homeland economics is to overburden the state. Governments are losing all restraint just when they need to curtail welfare spending. Ageing populations weigh down budgets with extra bills for pensions and health care. Rising interest rates make everything worse. After a bond-market crisis in 2022, Britain’s right-wing government is raising taxes, as a share of GDP, by more than in any parliamentary term in the country’s history. As yields rise on long-dated bonds, indebted Italy looks wobbly again. America’s rising debt-service bill will probably match its all-time high before the end of the decade—testimony to the fiscal fragility of the new era.\nThe least visible, but potentially most costly flaw is that homeland economics is a blunt instrument in a time of rapid change. The energy and AI transitions are too big for any government to plan. Nobody knows the cheapest ways to decarbonise or the best uses of new technology. Ideas need to be tested and channelled by markets, not governed by checklists from the centre. Excessive regulation will inhibit innovation and, by raising costs, make change slower and more painful.\nDespite its flaws, homeland economics will be tough to restrain. People enjoy spending other people’s money. As government budgets get bigger, the special interests that feed on them will grow in size and influence. It is harder to withdraw protection and handouts than to grant them—particularly with more elderly voters, who have less of a stake in economic growth. Anyone doe-eyed about the arc of history bending towards progress should remember that a century ago Argentina was about as rich as Switzerland.\nPlan for the road ahead\nYet disillusionment will eventually set in. That may be because fiscal extravagance catches up with indebted governments. Perhaps the rent-seekers’ greed will become too hard to conceal. Or a stagnating, repressive China may no longer hold out the promise of state-directed prosperity.\nWhen change comes, it can be surprisingly swift—in democracies, at least. In the 1970s the tide turned in favour of free markets almost as fast as it has turned against them today, leading to the election of Margaret Thatcher and Ronald Reagan. The task for classical liberals is to prepare for that moment by defining a new consensus that adapts their ideas to a more dangerous, interconnected and fractious world. That will not be easy, especially in the face of the rivalry between America and China. But it has been done in the past. And think of the prize. ■\nFor subscribers only: to see how we design each week’s cover, sign up to our weekly Cover Story newsletter.",https://www.economist.com/leaders/2023/10/05/are-free-markets-history,
1,Why Africans are losing faith in democracy,"ussia are happy to step in. So, too, are unsqueamish middling powers such as Turkey and the United Arab Emirates. Western governments have sometimes acted shabbily, turning a blind eye to a coup in Chad and electoral theft in Congo. Their hypocrisy undermines the democratic values they espouse. \nAfrica is not the only part of the world where democratic disillusion is spreading. A whopping 62% of Americans and 56% of French told a Pew poll last year that they were not satisfied with democracy in their countries. Among young Americans, nearly a fifth think a dictatorship would be preferable. The big difference is that rich, mature democracies have solid institutions that make a coup virtually impossible. In much of Africa the army and its cronies are all too ready to seize control. \nOnce the men with guns are in charge, they are hard to dislodge. They postpone elections indefinitely and remove even the threadbare checks on executive power that once existed. They govern terribly, but if the joyful crowds that greet some coups change their minds about their new rulers, there is little they can do about it. Equatorial Guinea’s president seized power in 1979. He is still in office, and his luxury-loving son may succeed him. Autocracy lacks the built-in correction mechanism of true democracy: the promise that, if governments are no good, voters can sack them. And because many African countries have festering ethnic tensions and territorial disputes, coups and dictatorships often lead to war, as has happened in Sudan. \nReversing Africa’s turn away from democracy will not be easy. It is a task, first and foremost, for Africans themselves. The African Union, a regional body, should once again take seriously its old “no-coup” policy, and ostracise putschists. More important, African governments that claim to be democratic will have to govern better, by curbing corruption, fostering growth and resisting the temptation to hogtie the opposition. For example, the World Bank reckons that implementing the African Continental Free Trade Area could raise incomes by 9% by 2035 by removing obstacles to trade. Yet its members are dragging their feet. \nRich countries can help. They ought to press ahead with restructuring unsustainable debts and make good on a long-standing, unkept promise to spend $100bn a year to help poor countries with climate change. The World Bank and IMF could help crowd in investment, especially if their capital were topped up. The West would do well to welcome more African migrants to study and work; some will return home with useful skills and others will send back money to educate nieces or bankroll new businesses. \nTo help improve African security, America, which is more popular than former colonial powers such as Britain and France, could keep training and arming legitimate forces battling jihadists and other insurgents. The European Union must not cut funding for African-led peacekeeping missions, such as the one in Somalia that is now being wound down.  \nFrom cradle of humanity to centre of gravity\nThe main reason to wish for progress in Africa is to benefit Africans. But the rest of the world has a stake, too. Africa is the only continent where population growth is fast. By 2030 nearly one in three people entering working age will live there. Many of humanity’s big challenges, from climate change to pandemics, will be harder to tackle if Africa is dysfunctional. There is no guarantee a more democratic Africa will be prosperous and peaceful, but one ruled by autocrats and generals will surely not be. ■\nFor subscribers only: to see how we design each week’s cover, sign up to our weekly Cover Story newsletter.",https://www.economist.com/leaders/2023/10/05/why-africans-are-losing-faith-in-democracy,
2,"The ousting of Kevin McCarthy: bad for America, worse for Ukraine","ng funding to the floor and allow the cross-party majority in the House that supports Ukraine to vote. The convention that only legislation supported by a majority of the majority can come to the House floor is a pointless one that ought to be scrapped. Doing so would make it harder for a small group of nihilists to prevent anyone else from passing laws.\nA more likely outcome is that Congress will stick to the usual way of doing things. The House will eventually find more money for Ukraine—but not until the end of the year, when a gigantic spending bill arrives before the Christmas break. That needless delay will undermine American credibility. By encouraging Vladimir Putin to wait for the West’s support to peter out, it may cost Ukrainian lives, too. ■",https://www.economist.com/leaders/2023/10/04/the-ousting-of-kevin-mccarthy-bad-for-america-worse-for-ukraine,
3,Rising bond yields are exposing fiscal fantasy in Europe,"y choose to follow the rules set in Brussels and trim spending at home, because it risks irking voters. \nThat leaves Italy subject to discipline from investors and the ecb. The role of the central bank is far clearer than it was during the depths of the euro zone’s debt meltdown. Should spreads on government debt start to spiral out of control, the ecb has committed itself to buying that debt. In July last year the bank also said it would seek to aid the smooth transmission of monetary policy, by buying a country’s debt if spreads rise by more than it deems to be warranted by economic fundamentals. \nMeloni-drama \nYet none of this means that the ecb will backstop reckless fiscal policy. Its programmes come into force only if the country in question accepts budgetary discipline. The central bank’s focus is unwarranted rises in spreads, rather than the level of the interest rate itself—and it is that which is a problem for Italy. Moreover, having been an enthusiastic buyer of government bonds during the pandemic, the ecb will soon decide how to shrink its holdings, which may further reduce demand for Italian bonds. \nThe scene is set for more market jitters. Ms Meloni’s government could begin to curb spending before then. More likely, though, she will wait for nervous investors and rising borrowing costs to force her hand. A reckoning with reality is almost certain. The only question is how much drama is needed first. ■",https://www.economist.com/leaders/2023/10/04/rising-bond-yields-are-exposing-fiscal-fantasy-in-europe,
4,"In an ugly world, vaccines are a beautiful gift worth honouring","amage they did—the military use of explosives in 20th-century wars is reckoned to have claimed 100m-150m lives—is so great that the idea feels as if it should be true. Vaccination is one of the few benefits conferred on humankind that measures up to that task. It is as though the world were able to run one of the terrible wars of the 20th century in reverse, saving millions of lives a year, every year. Si expiationem requiris, circumspice. ■",https://www.economist.com/leaders/2023/10/05/in-an-ugly-world-vaccines-are-a-beautiful-gift-worth-honouring,
5,Rishi Sunak is wrong to amputate Britain’s high-speed rail line," the government to speed up infrastructure projects, that would be something. But believing in this would be as optimistic as the project’s initial budget projections. The government is not some innocent bystander in this mess. It has been slow to issue national policy statements, crucial documents that underpin planning-assessment processes. From wind farms to housing, it runs scared of NIMBYs. Mr Sunak had nothing to say about the obstacles to building in his speech.\nIndeed, this week’s amputation is likely to raise infrastructure costs yet further. The presumption that really big infrastructure projects will survive changes of government, or even party leaders, is no longer safe. After this decision, contractors will therefore charge a higher risk premium. The amount of time and money consumed in planning applications is likely to increase, too. One lesson NIMBYs will take from this fiasco is that delaying projects can eventually lead to their demise.      \nMr Sunak says he is making hard choices, but with an election looming and the Tories trailing, the reversal looks more like political expediency. Last month he pushed back deadlines to phase out new petrol cars; now he claims that people care more about potholes than about high-speed rail. That may be true in a narrow sense, but a fundamental job of central government is to build strategic infrastructure. Mr Sunak’s HS2 decision flies in the face of his vaunted long-termism. ■",https://www.economist.com/leaders/2023/10/04/rishi-sunak-is-wrong-to-amputate-britains-high-speed-rail-line,
6,Letters to the editor | Oct 7th 2023 Edition,"iveness. \nThose seeking power must spell out new ideas, even if at first they sound naive, otherwise newcomers like Mr Stewart will have no legitimacy to reform how any country is run. Change in Britain might include proportional representation, randomly selected citizens’ assemblies, doing something new with the House of Lords, a mix of all these and more. True insanity is to keep banging our heads against the wall of the same outdated voting system and to expect that it will produce a better result.\nHugh Pope\nBrussels\nLike that Japanese soldier who hid in the jungle until 1974 Britain’s parties are survivors of dead conflicts. The MPs they pick and control for our approval are tied to manifestos with minority support. Our simplified elections are cockfights between the two main parties, one of which expects to win. Unlike Europe’s other voters, ours despise coalitions and proportional representation as formulas for sissies. As a result we have alternating rule by one party that the majority of voters have usually rejected, which is on the hook to its remnant membership. \nRod Tipple\nCambridge\n\nCan AI spot fake science?\nYou ask whether artificial intelligence could transform science itself, highlighting the potential for AI algorithms to trawl through the global academic literature for patterns and insights (“I, robot scientist”, September 16th). It is a troubling reality that the reliability and trustworthiness of this literature is undermined by a significant proportion of content that is fraudulent, dishonest and fake, for reasons which are often related to the career advancement of the miscreants. \nSome of this material is weeded out by suspicious readers, reviewers and editors, but an unknown volume escapes censure to contaminate the academic gene pool. In my own wide-ranging field of medicine, information from fraudulent and misleading papers can have a significant adverse impact upon human health and well-being. \nHence there is a real danger that trawling AI for insights will naively integrate the good, the bad and the ugly with the erroneous and potentially damaging. The solutions to this problem are not yet clear, but awareness of the potential for harm  is an important first step. \nDavid Rew\nFaculty of medicine\nUniversity of Southampton\nYou focus on using AI in the fundamental sciences rather than on applied research.  Arguably, the latter is the area where humanity will need most of its breakthroughs to prevent climate and other catastrophes before it’s too late, given the time it takes from fundamental research to broad commercialisation.  AI’s prowess in “interpolation”, and ability to rapidly access existing knowledge is listed as a limitation, but should be seen as a strength and an enabler to researchers and engineers who need to combine insights across scientific and technological domains in order to solve intractable challenges.\nThe implications to industrial R&D is threefold. First, companies must ensure that AI is broadly accessible to, and deployed by, their researchers, rather than residing exclusively with a separate team of data scientists. Second, firms should invest in knowledge and data sharing across the entire company and even with external innovation partners. And finally, they should make the necessary changes to their working practices and incentive structures (more agile, more cross disciplinary; with incentives focused on deployment not invention) so that future AI-inspired R&D breakthroughs can be developed and commercialised more systematically.\nAI will not replace experimentation nor the experimenter, although fewer of both will probably be needed. The gravy train it promises for R&D is in making researchers into better problem-solvers. \nMichael Kolk \nBen Thuriaux-Alemán\nArthur D. Little \nAmsterdam and London\nTo describe the concerns of some people about AI and the “extinction of humanity” as fretting, whereas others are just focused on its potential, is a classic on the one hand, on the other hand formulation. I can’t see how you can reasonably balance extinction with anything else. In those stakes, we don’t fret enough.\nLori Fontanes\nRye, New York\nExtremists in power\nYou argued that the far right in Europe would become less dangerous if it entered government (“The real threat from Europe’s hard right”, September 16th). I am not so sure. That was precisely the argument used to obtain President Hindenburg’s approval for bringing the National Socialists into government in 1933. But why turn to ancient history? Just look at Hungary’s Fidesz party, which has become much more extreme since attaining a governing supermajority in 2010. Beyond Hungary, there is a great deal of evidence—Nuevas Ideas in El Salvador, Law and Justice in Poland, the True Finns in Finland—that extremist parties and leaders do not in fact become more moderate after achieving power. Your claim seems to involve the triumph of hope over experience.\nMatthew Draper\nCharlottesville, Virginia\n\nYou chose a photo of a shaven-headed man with an earring to illustrate your cover on the far right (September 16th). The reality is that the hard right today has support from men and women of all ages, races, religion, sexual orientation and classes, both with and without hair. Some of them even wear suits. \nJack Lard\nBalding but not extreme\nParis\nNow you listen here!\nI speak for all Monty Python fans when I posit that, although Elon Musk’s Messiah status remains unclear, with all his self-acknowledged faux pas he certainly is a very naughty boy (“Messiah, menace or both?”, September 16th).\nTom Appleton\nHaywards Heath, West Sussex",https://www.economist.com/letters/2023/10/05/letters-to-the-editor,
