,title,article,link,summary
12,Detroit wants to be the first big American city to tax land value,"value of residential land is very low, which makes it an easier sell to voters.\nThe hope is that taxing land more will in fact spur development. Right now, says Alex Alsup of Regrid, a data firm, Detroit has “a very pure version of speculation”. As downtown booms, people who bought land nearby years ago—such as the owners of the car parks—merely have to wait for investment nearby to raise the value of their own land. Higher taxes might force them to sell up to people who will build on it. “It is entirely possible that this land tax has the ability to free up properties,” says Kofi Bonner, the ceo of Bedrock.\nThe bigger immediate benefit, though, comes from reducing taxes on most residents. The city argues that 97% of homeowners will get a tax cut. Lower tax rates on improvements ought to encourage people to invest in properties—and help some avoid falling behind on their taxes. Though they raise little, Detroit’s property taxes are punishing to poor homeowners. Between 2011 and 2015, according to a study published in 2019, one in four city properties went into tax foreclosure, their owners having fallen behind on payments. \nBut Bernadette Atuahene, one of the authors of that study, suggests that high rates were not the only problem. What mattered more was that after the great financial crisis, Detroit’s assessor systematically overvalued the homes of the poorest residents. When people could not pay, Wayne County, which includes the city, added interest at 18%. Homes ended up auctioned, with any excess over the tax owed banked by the county. Ms Atuahene worries that the proposed new tax does nothing to fix this problem—and if residential land ends up overvalued, may exacerbate it. “We currently have an assessment division that’s not doing its job,” she says. \nGetting assessments right is one of the long-standing challenges of land-value taxes, and explains why they are so rare. Still, if the city can do that well, there will be real gains. Gabriel McNeil, a 61-year-old former chef who now lives on disability benefits, says that even a small tax cut would help him a lot. Having bought his home for just $8,000 in 2013, he struggles with tax payments of thousands of dollars each year. “The property tax is not designed for lower-income people at all,” he says. “It’s not easy to keep up.” For some, any cut is better than nothing. ■\nStay on top of American politics with Checks and Balance, our weekly subscriber-only newsletter, which examines the state of American democracy and the issues that matter to voters.",https://www.economist.com/united-states/2023/10/05/detroit-wants-to-be-the-first-big-american-city-to-tax-land-value,
13,What America should really learn from Dianne Feinstein," them. Ms Feinstein noted that the CIA director at the time, Michael Hayden, testified then that the techniques included such innovations as a “tummy slap” that were “minimally harmful” and “applied in a highly clinical and professional manner”.\n“They were not,” she continued, with icy restraint. As the report indelibly recorded, detainees were stripped naked and put in nappies, struck and chained in “stress positions” with their hands over their heads, kept awake for days at a time, isolated and doused with cold water, menaced with weapons or harm to their families. Some were waterboarded dozens of times or subjected to forced “rectal hydration” so that their captors could establish what they called “total control over the detainee”. Mr Jones and other staff had examined 20 cases in which the CIA claimed these techniques produced critical information. “Not a single case holds up,” she said. Captives told their persecutors what they wanted to hear. Some CIA officers objected to the techniques but were ignored.\nMark Udall, a former senator from Colorado who was a member of the Intelligence Committee, says Ms Feinstein was “tormented” to learn how the CIA had misled Congress. “Dianne could be cautious,” he says. “She was a centrist Democrat in some respects. But, boy, when it really mattered, she had her eyes on history and future generations.”\nTo serve out Ms Feinstein’s term, Gavin Newsom, the governor of California, swiftly appointed Laphonza Butler, a former labour leader who was the president of EMILY’s List, which works to elect female Democrats who support abortion rights; she becomes the first black openly lesbian senator. Ms Butler, who at 44 is a newcomer to elective office, has not decided whether she will run to hold the seat when it is up next year. Three formidable members of the House of Representatives are competing in what is already a costly, bruising Democratic primary, to be decided in March. \nDoing the right thing\nMs Feinstein stayed in the Senate too long. She faded from a commanding presence to a poignant one. Yet the lessons she leaves are less about when to give up the job than how to do it right in the first place. She first won her seat in 1992, when California still elected some Republicans to statewide office.  Her successor is unlikely to share her bipartisan instincts, but she, or he, would do well to study the patriotism that made Ms Feinstein such an independent-minded critic of the institutions she revered. \nPublishing the torture report did not cause bloodshed. It also did not, as Ms Feinstein said it would not, remove the stain of torture committed in Americans’ names. But it did, as she said it would, “say to our people, and the world, that America is big enough to admit when it’s wrong, and confident enough to learn from its mistakes”. That was an important message then, and it is a comforting reminder now that America is capable not just of losing its way but also, with the right leaders, of finding it again. ■\nRead more from Lexington, our columnist on American politics:\nA Trump Party in the Reagan Library (Sep 28th)\nAmerica’s dumbest, wildest budget fight yet (Sep 21st)\nWhy some GOP candidates don’t act as aggrieved as Donald Trump (Sept 14th)\nStay on top of American politics with Checks and Balance, our weekly subscriber-only newsletter, which examines the state of American democracy, and read other articles about the elections of 2024.",https://www.economist.com/united-states/2023/10/05/what-america-should-really-learn-from-dianne-feinstein,
14,The Caribbean is awash with illegal American guns,"iami, says in the past year his agency has witnessed a “massive uptick” in weapons being smuggled from the United States to the region, especially to Haiti. Seizures are of increasingly lethal weapons, including belt-fed machine-guns and armour-piercing rifles.\n\nCaribbean leaders fret about a spillover effect from Haiti. This is because it is not only a destination country for arms, but exports them to the rest of the region, says Simonetta Grassi of the UN Office on Drugs and Crime (UNODC). Gangs in Haiti have long worked with their equivalents in Jamaica, trading guns for drugs; now they are trading guns for food. The weaponry in Haiti is of good quality, says Luis Moreno, a former ambassador for the United States, who has served in Jamaica and Haiti. It looks like it comes from “the front lines in Afghanistan”, he says. \nFears are particularly acute in the Dominican Republic, which shares a 400km (240-mile) land border with Haiti. On a Monday morning in early September dozens of Haitians crossed the bridge into Dajabón, in the north-western part of the Dominican Republic. Many Dominicans fear arms and gang members will come across, too. A few days later, four Dominicans were shot dead in Dajabón, apparently by Haitian robbers. On September 15th, blaming a dispute over the construction of a canal in Haiti that would tap into a shared river, the Dominican government completely closed its land, air and sea borders with its neighbour.\nCaribbean countries are now demanding more action from the United States. In April Andrew Holness, Jamaica’s prime minister, argued: “As we have assisted them in the war on drugs, they must assist us in the war on guns.” In June Caricom and the United States launched the Caribbean Crime Gun Intelligence Unit (CCGIU). This will work with international organisations, such as Interpol, to carry out arms-trafficking investigations. \nAnecdotal evidence from seizures and court cases suggests the weapons are sent in small numbers, typically two to two dozen. The process is not sophisticated, says Matt Schroeder of Small Arms Survey, a Geneva-based NGO. Often they are hidden among clothes or food. More than half of the 29 trafficking networks studied by the Small Arms Survey used shipping companies to send their contraband. Last year the Haitian police intercepted 22 guns, including 18 assault rifles, among relief supplies such as powdered milk coming by boat from Fort Lauderdale and apparently addressed to the Episcopal Church in Haiti. (Some members of the Haitian branch of the church were arrested in connection with the case, but not charged. Both they and the church deny any involvement.) \nThe risk is worth it. Handguns that sell for $400 to $500 in the United States can be resold for as much as $10,000 in Haiti, according to the UN. Haiti’s ports are “the Wild West”, in part because they have no scanners, according to a port official. For two months last year gangs took over a fuel port in the Haitian capital.\nA commitment to tackling arms trafficking is missing in Haiti, says Edwin Paraison, a former consul for Haiti in the Dominican Republic. But elsewhere “enormous efforts” are being made, he says. Some 17 countries in the Caribbean now use eTrace, an internet-based system set up by the United States in 2005 to provide information about the history of a weapon. (Haiti does not use it.) Countries including Grenada and Dominica are tightening their laws on legal gun ownership and introducing stiffer penalties for violations. Jamaica and the Dominican Republic are upgrading technology at their borders. \nThe CCGIU should help. It has already launched ten cases. “There is a lot of intel out there,” says an American official. Ms Grassi says the Caribbean countries need their own cases, rather than simply extraditing people to the United States, to send the message that justice will be done at home. Haiti signed an agreement this summer with the United States to create its own Trans-National Criminal Investigative Unit, that would create vetted police units with 14 American advisers.  \n\nMeanwhile, the Dominican Republic is trying to reduce the circulation of illegal arms. Since 2021 the government has given cash and shopping coupons to anyone who hands in a gun, which is then destroyed (the programme also rewards officials who intercept them). In three years they have received 15,500 weapons, compared with 3,280 in the previous four, boasts Jesús Vásquez, the interior minister. He reckons this has helped his country avoid the levels of violence seen elsewhere, despite being a hub for drug-trafficking in the Caribbean. Its murder rate in 2022 was 12.\nTackling illegal arms and their trafficking is especially hard for smaller countries: after Haiti and the Dominican Republic, Jamaica is the next-most-populous of the Caricom countries, with only 3m people. In a country like Trinidad & Tobago with a population of 1.5m or Grenada with 126,000, there may be only a couple of officials assigned to the issue. The costs of gun violence are high for underfunded health-care systems. According to the Small Arms Survey, in Jamaica it costs an average of $3,249 to treat a gunshot wound. Annual health spending per person is $326.\nOne shot\nMr Salisbury, the HSI agent, says the United States is dedicating more resources to stopping guns leaving the country. But there is a limit to what American agencies and Caribbean governments can do while weapons are so readily available in the United States. President Joe Biden has tried to tighten regulation of the gun industry. The Bipartisan Safer Communities Act, passed in 2022, has made it more difficult to buy weapons in bulk in the United States. \nBut the Caribbean must tackle its gangs, too. Governments have tended to crack down hard on gangs—the mano dura, or iron-fist, approach—without putting in place the social programmes to stop them coming back, says Alexander Causwell, a security analyst who advises Jamaica’s government. Jamaica has long avoided dealing with communities where the majority of gangs operate, though last year its police and army created a joint anti-gang task-force to start doing it. Any multinational force sent to Haiti may be able to bring down violence there, but getting rid of its gangs will take generations. ■",https://www.economist.com/the-americas/2023/10/05/the-caribbean-is-awash-with-illegal-american-guns,
15,Mexico’s government is suing American gun manufacturers,,https://www.economist.com/the-americas/2023/10/05/mexicos-government-is-suing-american-gun-manufacturers,
16,South American governments are trying to curb illegal fishing,,https://www.economist.com/the-americas/2023/10/05/south-american-governments-are-trying-to-curb-illegal-fishing,
17,Narendra Modi has seized and politicised Indian cricket,"viously. Advertising revenues for the tournament are projected to be between 20bn and 22bn rupees ($240m-264m), at least 48% more than was generated by the previous World Cup, held in England. Such numbers explain the Indian cricket board’s dominance. Last year it sold five-year broadcast rights to the IPL for $6bn. Its total revenues were 44% more than those of its closest rival, the England and Wales Cricket Board. \nCricket’s popularity commands political attention, as the tournament will also show. It has indeed long been coveted by Indian politicians; Jawaharlal Nehru captained a Prime Minister’s XI. Yet in recent decades, the growth of television—then smartphone—ownership, which took cricket from a few big cities to India’s furthest corners, hugely increased its political potency. Among the politicians who piled in, Sharad Pawar, India’s agriculture minister between 2004 and 2014, ran cricket in Maharashtra, India and, through the International Cricket Council, the world. As chief minister of Gujarat, Narendra Modi took over the state’s cricket board in 2009. As prime minister he has achieved something new: a systematic takeover of cricket by his Bharatiya Janata Party (bjp).\nThe World Cup’s opening game, pitting England against New Zealand, is in the 130,000-seat Narendra Modi Stadium in the Gujarati city of Ahmedabad. Completed in 2020, the world’s biggest cricket stadium was first used to host a rally for Mr Modi and Donald Trump. It is the prime minister’s Coliseum, a venue for Modi-themed cricket extravaganzas, BJP rallies or both. Ahead of a match between Australia and India there in March Mr Modi appeared alongside his Australian counterpart, Anthony Albanese, in a sort of golden chariot. The adoring crowd reportedly included 80,000 BJP workers, given free tickets. \nIf India makes it to the World Cup final there, on November 19th, Mr Modi will no doubt attend. So will his de facto deputy, Amit Shah, another former boss of cricket in Gujarat; and Mr Shah’s son, Jay Shah, who runs India’s cricket board. Cricket under Mr Modi, like so much else, has been centralised and co-opted.\nAs well as illustrating Mr Modi’s flair for amassing power, his party’s cricket management reflects its troubling use of it. Indian Muslims are fairly represented in cricket. Around 12% of professional players are Muslim, in line with their share of the population. Yet those who play for India are targeted by the Islamophobic trolls that have multiplied under Mr Modi. \nPakistan’s cricketers are faring worse. Once superior to India’s (elegant Indian batsmen struggled against fierce Pakistani fast bowling) cricket in Pakistan has deteriorated with the country. India is twisting the knife. The younger Mr Shah, who also runs the Asian Cricket Council, has helped throttle cricket ties between the two countries. Pakistan’s players, in a gratuitous slight, were the last to receive their visas and schedule for the World Cup.\nSuch bullying Indian behaviour has been a feature of its rise in cricket, which has intensified under the BJP. The spread of private Indian cricket leagues is eroding the primacy of international competition, one of cricket’s distinctive features, and weakening foreign cricket boards. India’s cricket bosses are deaf to the complaints this is raising. Viewing cricket as an arm of national power, they are mainly intent on increasing their control of it. The ICC’s media revenues were in the past split fairly evenly between cricket-playing countries. Between 2024 and 2027 India will pocket 39%. How it spends the cash is unclear. Most Indian cricket loot is handed to state-level boards, often run by politicians. Hardly any provide audited accounts. \nIndian cricket bosses dismiss foreign criticism as sour grapes. In fact the cricket world has accepted the reality of India’s dominance; no one disputes its right to enrich and reshape its game. Yet great power is supposed to bring more responsibility, which India’s bosses seldom display. As an early demonstration of the power India is accruing in many fields, its behaviour in cricket is largely discouraging. ■",https://www.economist.com/asia/2023/10/04/narendra-modi-has-seized-and-politicised-indian-cricket,
18,Virtual influencers are burning up South Koreans’ Instagram feeds,,https://www.economist.com/asia/2023/10/05/virtual-influencers-are-burning-up-south-koreans-instagram-feeds,
19,New Zealand tires of its cuddly liberal government,"ty to solve their problems either. Combined, Labour and National are likely to receive their lowest ever share of the vote, says Mr Hooton. Never before have both the two main parties been so unpopular. New Zealand’s system of proportional representation is boosting minor parties on both sides.\nTo reach a majority of 61 seats in the country’s unicameral parliament, Mr Luxon will need support from ACT, a growing libertarian party, and possibly an old stalwart, New Zealand First. Its 78-year-old leader, Winston Peters, lost his seat at the previous election, but is staging a comeback by stoking anger against a “cultural cabal” of “elite virtue-signallers”. The two smaller parties disagree on most things, but both appeal to disaffected conservatives by pledging toughness on crime and thrusting race into political debate by promising an end to the so-called “Maorification” of New Zealand. Between them, they could win almost 20% of the vote.\nA putative right-wing coalition would not signal that New Zealand is “moving into that brand of hard-right politics that we’ve seen in Italy and Austria,” says Sir John. Its electoral system keeps politics relatively centrist and “punishes small parties who are in government that don’t act as good, stable partners”. Ms Ardern pioneered a cuddlier politics, but Kiwis now seem to want a spikier approach. ■",https://www.economist.com/asia/2023/10/05/new-zealand-tires-of-its-cuddly-liberal-government,
20,Japanese firms are leaving Tokyo for the sticks,"t clients and business partners. And while some employees might enjoy life in the idyllic countryside, plenty prefer the conveniences of the capital. Those with children worry about losing access to high-quality schools and colleges.\nAnother problem has been a lack of planning and co-ordination among the authorities. Instead of creating new economic hubs, many relocation efforts amount to “simply scattering [firms] across the country”, says Sato Motohiro of Hitotsubashi University in Tokyo. He believes that this is a hangover from Japan’s bygone boom period, where officials promoted an idea of “balanced development” in which the country’s thousands of municipalities were expected to grow at roughly the same pace. In recent years some alternative growth centres have emerged, though not enough to challenge Tokyo’s dominance. Hokkaido has attracted enterprises with its vast spaces. Kyushu, the southern region where TSMC, a Taiwanese semiconductor firm, is building a factory, promotes itself as Silicon Island. “The government needs to think more about differentiating between areas that need investing in, and those that don’t,” says Mr Sato. “Otherwise, Tokyo will keep winning.” ■",https://www.economist.com/asia/2023/10/05/japanese-firms-are-leaving-tokyo-for-the-sticks,
21,"M.S. Swaminathan, the man who fed India","impose tariffs on others illustrates the threats to Mr Swaminathan’s legacy. The growth of agricultural yields across the world has slowed in recent years amid rising temperatures and increasingly unpredictable growing conditions. India imposed the latest restrictions following an erratic monsoon. The rains arrived late, delaying the rice-planting season. When at last they came, they were so fierce that fields were inundated and crops destroyed, with some farmers losing what little they had managed to plant. The previous summer, heatwaves shrivelled as much as 15% of the wheat crop in some regions. Such extreme weather will become increasingly frequent as the Earth warms. India and the rest of South Asia are particularly vulnerable. \nEven as he campaigned for women’s empowerment and policies to improve nutrition in recent years, Mr Swaminathan sounded the alarm on what global warming would mean for food security. “Farmers can no longer rely on historical averages for rainfall and temperature,” he wrote in 2011. Drought and floods may “spell disaster”. His successors are developing wheat and rice varieties that are better able to cope with these threats. \nYet there are signs that such innovations may be insufficient, meaning vast swathes of arable land could eventually be abandoned. Other methods popularised during the green revolution have, meanwhile, fallen out of favour. Mechanical irrigation and intensive monocultures, for example, have turned out to degrade the environment by depleting groundwater and stripping the soil of nutrients. Yet they remain in widespread use in India and elsewhere, storing up vulnerabilities in the global food system. A new and greener revolution in food production is urgently needed. ■\nRead more from Bagehot, our columnist on British politics: \nBlind optimism is the only bet for Britain’s Tories (Sep 28th)\nRussell Brand was the norm in the nasty noughties (Sep 19th)\nCentrists need to stop worrying and learn to love politics (Sep 14th)\nAlso: How the Bagehot column got its name",https://www.economist.com/asia/2023/10/03/ms-swaminathan-the-man-who-fed-india,
